### ISSUE TITLE
My Geneva is not working properly，Who can help me？

### ISSUE THREAD

**Issue by dandinw** [Kkevsterrr/geneva#51]
I use the following command to start geneva in Centos7:
[root@localhost geneva]# python3 engine.py --server-port 80 --strategy "[TCP:flags:SA]-tamper{TCP:window:replace:4}-|"
2023-01-05 16:40:33 WARNING:[ENGINE] No environment ID given, one has been generated (biuvkyzo)
2023-01-05 16:40:33 DEBUG:[ENGINE] Engine created with strategy [TCP:flags:SA]-tamper{TCP:window:replace:4}-| \/ (ID biuvkyzo) to port 80
2023-01-05 16:40:33 DEBUG:[ENGINE] Configuring iptables rules
2023-01-05 16:40:33 DEBUG:[ENGINE] iptables -A OUTPUT -p tcp --match tcp --dport 80 -j NFQUEUE --queue-num 2
2023-01-05 16:40:33 DEBUG:[ENGINE] iptables -A INPUT -p tcp --match tcp --sport 80 -j NFQUEUE --queue-num 1
2023-01-05 16:40:33 DEBUG:[ENGINE] iptables -A OUTPUT -p udp --match udp --dport 80 -j NFQUEUE --queue-num 2
2023-01-05 16:40:33 DEBUG:[ENGINE] iptables -A INPUT -p udp --match udp --sport 80 -j NFQUEUE --queue-num 1
2023-01-05 16:40:33 DEBUG:[ENGINE] NFQueue Initialized after 0

When I access and grab packets with tcpdump on another machine, it looks like this：
17:11:28.686023 IP 114.244.206.187.7440 > 172.19.52.161.http: Flags [S], seq 3706088398, win 29200, options [mss 1400,sackOK,TS val 87376608 ecr 0,nop,wscale 7], length 0
17:11:28.686074 IP 172.19.52.161.http > 114.244.206.187.7440: Flags [S.], seq 3459820145, ack 3706088399, win 1152, options [mss 1460,sackOK,TS val 13288807 ecr 87376608,nop,wscale 0], length 0
17:11:28.724237 IP 114.244.206.187.7440 > 172.19.52.161.http: Flags [.], ack 1, win 229, options [nop,nop,TS val 87376648 ecr 13288807], length 0

I think the returned win size in the [S.] (syn+ack) phase should be 4, but it doesn't seem to work as expected, the win is 1152

**Comment by Kkevsterrr** [comment]
You might be missing the `--server-side` flag on the server's engine

**Comment by dandinw** [comment]
Thank you for solving my problem
